{"$defs":{"provenance":{"additionalProperties":false,"properties":{"license":{"minLength":1,"type":"string"},"licenseFile":{"const":"README.md"},"materialSha256":{"$ref":"#/$defs/sha256"},"revision":{"minLength":1,"type":"string"},"source":{"minLength":1,"type":"string"},"sourcePath":{"const":"../parser_contracts/logical_hash/golden-v1.json"}},"required":["source","sourcePath","revision","materialSha256","license","licenseFile"],"type":"object"},"sha256":{"pattern":"^[0-9a-f]{64}$","type":"string"}},"$id":"https://schemas.mm-chat.invalid/parser/jcs-logical-hash-manifest-v1.schema.json","$schema":"https://json-schema.org/draft/2020-12/schema","additionalProperties":false,"properties":{"caseCount":{"const":24,"type":"integer"},"profile":{"const":"c1-contract-profile"},"provenance":{"$ref":"#/$defs/provenance"},"schemaVersion":{"const":"mm-chat.jcs-logical-hash-manifest.v1"},"suiteId":{"const":"logical-hash-golden-v1"}},"required":["schemaVersion","suiteId","profile","caseCount","provenance"],"type":"object"}