{"caseCount":24,"profile":"c1-contract-profile","provenance":{"license":"MIT (project-authored fixture data only)","licenseFile":"README.md","materialSha256":"648073443197f6d94aad5e0825f8a4e622370b7e54c011c8b3e99f5bea817448","revision":"C1.1 logical hash golden v1 (2026-07-13)","source":"MM Chat parser contract logical hash golden v1","sourcePath":"../parser_contracts/logical_hash/golden-v1.json"},"schemaVersion":"mm-chat.jcs-logical-hash-manifest.v1","suiteId":"logical-hash-golden-v1"}